{
  "affiliations": [
    {
      "claim_ids": [
        "claim_61e44f67d05c44bc1cce"
      ],
      "ended_at": null,
      "id": "aff_08fe9e49d44975c4c246",
      "is_primary": true,
      "observed_at": "2026-08-21T18:52:08Z",
      "organization_id": "org_auto_fa05a23ebc3a10b954b9",
      "source_url": "http://js.chd.edu.cn/xxgcxy/ly_5462/list.htm",
      "started_at": null,
      "status": "current",
      "title": "教授"
    }
  ],
  "claim_ids": [
    "claim_61e44f67d05c44bc1cce"
  ],
  "contacts": [
    {
      "affiliation_id": "aff_08fe9e49d44975c4c246",
      "claim_ids": [
        "claim_61e44f67d05c44bc1cce"
      ],
      "is_primary": true,
      "normalized_value": "yingli@chd.edu.cn",
      "observed_at": "2026-08-21T18:52:08Z",
      "source_url": "http://js.chd.edu.cn/xxgcxy/ly_5462/list.htm",
      "status": "current",
      "type": "email",
      "value": "yingli@chd.edu.cn"
    }
  ],
  "created_at": "2026-08-21T18:52:08Z",
  "field_provenance": {
    "affiliations": [
      "claim_61e44f67d05c44bc1cce"
    ],
    "email": [
      "claim_61e44f67d05c44bc1cce"
    ],
    "name": [
      "claim_61e44f67d05c44bc1cce"
    ],
    "profile_url": [
      "claim_61e44f67d05c44bc1cce"
    ],
    "recent_papers": [
      "claim_61e44f67d05c44bc1cce"
    ],
    "research_directions": [
      "claim_61e44f67d05c44bc1cce"
    ],
    "status": [
      "claim_61e44f67d05c44bc1cce"
    ],
    "title": [
      "claim_61e44f67d05c44bc1cce"
    ]
  },
  "id": "mentor_c9491fa7b4f55f6c4ffb",
  "last_verified_at": "2026-08-21T18:52:08Z",
  "names": [
    {
      "claim_ids": [
        "claim_61e44f67d05c44bc1cce"
      ],
      "is_primary": true,
      "kind": "native",
      "value": "李颖"
    }
  ],
  "profiles": [
    {
      "affiliation_id": "aff_08fe9e49d44975c4c246",
      "claim_ids": [
        "claim_61e44f67d05c44bc1cce"
      ],
      "observed_at": "2026-08-21T18:52:08Z",
      "status": "current",
      "url": "http://js.chd.edu.cn/xxgcxy/ly_5462/list.htm"
    }
  ],
  "recent_papers": [
    "Li, Y., Bai, F., Lyu, C., Qu, X., & Liu, Y. (2025). A systematic review of generative adversarial networks for traffic state prediction: Overview, taxonomy, and future prospects. Information Fusion, 117, 102915.",
    "Zhang, Z., Cheng, Q., Li, Z., Fang, Y., & Li, Y.* (2025). MC-HSTA: A multi-source cross-domain hybrid spatio-temporal attention network for traffic flow prediction. Neural Networks, 108358.",
    "Li, Y., Li, P., Yan, D., Liu, Y., & Liu, Z. (2024). Deep knowledge distillation: A self-mutual learning framework for traffic prediction. Expert Systems with Applications, 252, 124138.",
    "Liu, Y., Lyu, C., Bai, F., Parishwad, O., & Li, Y.* (2024). The role of intelligent technology in the development of urban air mobility systems: A technical perspective. Fundamental Research, 4(5), 1017-1024.",
    "Fei, Y.,Li, Y., Liu, Y., & Niu, M. (2024, December). TPRGraphMM: Graph-Based Vehicle Map Matching by Travel Pattern Recognition. In 2024 20-th International Conference on Mobility, Sensing and Networking (MSN) (pp. 1055-1060). IEEE Computer Society.",
    "Li, Y., Zhao, L., Gao, K., An, Y., & Andric, J. (2022). Revealing driver psychophysiological response to emergency braking in distracted driving based on field experiments. Journal of intelligent and connected vehicles, 5(3), 270-282.",
    "李颖,费怡瑄,安毅生,刘洋, 2024.智能交通场景下的地图匹配技术综述.交通运输工程学报24(5): 301-332.",
    "王迪,李颖,胡宇娇,孙昊程, 2024.基于机器学习的网约车拼车需求预测研究.汽车安全与节能学报15(5): 723-731."
  ],
  "research_directions": [
    "智能交通系统、交通流理论与交通控制、自动驾驶协同技术、数据驱动的自动驾驶决策方法、大模型赋能交通智能管控、异质交通流建模"
  ],
  "resolution_ids": [],
  "schema_version": 1,
  "status": "active",
  "status_observed_at": "2026-08-21T18:52:08Z",
  "status_reason": null,
  "status_source_url": "http://js.chd.edu.cn/xxgcxy/ly_5462/list.htm",
  "title": "教授",
  "updated_at": "2026-08-21T18:52:08Z"
}
