{
  "affiliations": [
    {
      "claim_ids": [
        "claim_ffa05b4523efe5839da7"
      ],
      "ended_at": null,
      "id": "aff_a13f2ba9d99aa9f6f739",
      "is_primary": true,
      "observed_at": "2026-08-11T13:32:48Z",
      "organization_id": "org_auto_a5e4797a0f501cf390eb",
      "source_url": "https://software.nju.edu.cn//rentw/index.html",
      "started_at": null,
      "status": "current",
      "title": "教授"
    }
  ],
  "claim_ids": [
    "claim_ffa05b4523efe5839da7"
  ],
  "contacts": [
    {
      "affiliation_id": "aff_a13f2ba9d99aa9f6f739",
      "claim_ids": [
        "claim_ffa05b4523efe5839da7"
      ],
      "is_primary": true,
      "normalized_value": "rentw@nju.edu.cn",
      "observed_at": "2026-08-11T13:32:48Z",
      "source_url": "https://software.nju.edu.cn//rentw/index.html",
      "status": "current",
      "type": "email",
      "value": "rentw@nju.edu.cn"
    }
  ],
  "created_at": "2026-08-11T13:32:48Z",
  "field_provenance": {
    "affiliations": [
      "claim_ffa05b4523efe5839da7"
    ],
    "email": [
      "claim_ffa05b4523efe5839da7"
    ],
    "name": [
      "claim_ffa05b4523efe5839da7"
    ],
    "profile_url": [
      "claim_ffa05b4523efe5839da7"
    ],
    "recent_papers": [
      "claim_ffa05b4523efe5839da7"
    ],
    "research_directions": [
      "claim_ffa05b4523efe5839da7"
    ],
    "status": [
      "claim_ffa05b4523efe5839da7"
    ],
    "title": [
      "claim_ffa05b4523efe5839da7"
    ]
  },
  "id": "mentor_85f4198221bd1e5aebc6",
  "last_verified_at": "2026-08-11T13:32:48Z",
  "names": [
    {
      "claim_ids": [
        "claim_ffa05b4523efe5839da7"
      ],
      "is_primary": true,
      "kind": "native",
      "value": "任桐炜"
    }
  ],
  "profiles": [
    {
      "affiliation_id": "aff_a13f2ba9d99aa9f6f739",
      "claim_ids": [
        "claim_ffa05b4523efe5839da7"
      ],
      "observed_at": "2026-08-11T13:32:48Z",
      "status": "current",
      "url": "https://software.nju.edu.cn//rentw/index.html"
    }
  ],
  "recent_papers": [
    "Xingyu Liu, Zongxing Ji, Piao Huang, and Tongwei Ren*. Real-time arbitrary video style transfer. ACM MM Asia, 2021. (Best Paper Candidate)",
    "Yuqi Gao, Jitao Sang, Chengpeng Fu, Zhengjia Wang, Tongwei Ren, and Changsheng Xu. Metadata connector: Exploiting hashtag and tag for cross-OSN event search. IEEE TMM, 2021, 23: 510-523.",
    "Xu Sun, Xinwen Hu, Tongwei Ren*, and Gangshan Wu. Human object interaction detection via multi-level conditioned network. ACM ICMR, 2020.(Best Paper Candidate)",
    "Fan Yu, Haonan Wang, Tongwei Ren*, Jinhui Tang, and Gangshan Wu. Visual relation of interest detection. ACM MM, 2020.",
    "Xiangnan He, Jinhui Tang, Xiaoyu Du, Richang Hong, Tongwei Ren, and Tat-Seng Chua. Fast matrix factorization with non-uniform weights on missing data. IEEE TNNLS, in press.",
    "Sheng-hua Zhong, Yuantian Wang, Tongwei Ren*, Mingjie Zheng, Yan Liu, and Gangshan Wu. Steganographer detection via multi-scale embedding probability estimation. ACM TOMM, 2019, 15(4): 1-23.",
    "Xu Sun, Yuan Zi, Tongwei Ren*, Jinhui Tang and Gangshan Wu. Hierarchical visual relationship detection. ACM MM, 2019.",
    "Fan Yu, Haonan Wang, Tongwei Ren*, Jinhui Tang and Gangshan Wu. Instance of interest detection. ACM MM, 2019."
  ],
  "research_directions": [
    "多媒体计算、媒体识别与理解的技术创新与应用"
  ],
  "resolution_ids": [],
  "schema_version": 1,
  "status": "active",
  "status_observed_at": "2026-08-11T13:32:48Z",
  "status_reason": null,
  "status_source_url": "https://software.nju.edu.cn//rentw/index.html",
  "title": "教授",
  "updated_at": "2026-08-11T13:32:48Z"
}
