{
  "affiliations": [
    {
      "claim_ids": [
        "claim_d2303fe1071c6ab1df06"
      ],
      "ended_at": null,
      "id": "aff_8553c7192d3143bfdc7a",
      "is_primary": true,
      "observed_at": "2026-08-05T03:31:23Z",
      "organization_id": "org_auto_e379621dba894c5f5131",
      "source_url": "https://teacher.bupt.edu.cn/pengyuexing/zh_CN/index.htm",
      "started_at": null,
      "status": "current",
      "title": "副教授"
    }
  ],
  "claim_ids": [
    "claim_d2303fe1071c6ab1df06"
  ],
  "contacts": [
    {
      "affiliation_id": "aff_8553c7192d3143bfdc7a",
      "claim_ids": [
        "claim_d2303fe1071c6ab1df06"
      ],
      "is_primary": true,
      "normalized_value": "yxpeng@bupt.edu.cn",
      "observed_at": "2026-08-05T03:31:23Z",
      "source_url": "https://teacher.bupt.edu.cn/pengyuexing/zh_CN/index.htm",
      "status": "current",
      "type": "email",
      "value": "yxpeng@bupt.edu.cn"
    }
  ],
  "created_at": "2026-08-05T03:31:23Z",
  "field_provenance": {
    "affiliations": [
      "claim_d2303fe1071c6ab1df06"
    ],
    "email": [
      "claim_d2303fe1071c6ab1df06"
    ],
    "name": [
      "claim_d2303fe1071c6ab1df06"
    ],
    "profile_url": [
      "claim_d2303fe1071c6ab1df06"
    ],
    "research_directions": [
      "claim_d2303fe1071c6ab1df06"
    ],
    "status": [
      "claim_d2303fe1071c6ab1df06"
    ],
    "title": [
      "claim_d2303fe1071c6ab1df06"
    ]
  },
  "id": "mentor_19b73fa9db2f6b3d1040",
  "last_verified_at": "2026-08-05T03:31:23Z",
  "names": [
    {
      "claim_ids": [
        "claim_d2303fe1071c6ab1df06"
      ],
      "is_primary": true,
      "kind": "native",
      "value": "彭岳星"
    }
  ],
  "profiles": [
    {
      "affiliation_id": "aff_8553c7192d3143bfdc7a",
      "claim_ids": [
        "claim_d2303fe1071c6ab1df06"
      ],
      "observed_at": "2026-08-05T03:31:23Z",
      "status": "current",
      "url": "https://teacher.bupt.edu.cn/pengyuexing/zh_CN/index.htm"
    }
  ],
  "recent_papers": [],
  "research_directions": [
    "智能信息处理、机器学习与深度学习、工业大数据及其在电磁探测、电磁成像、卫星遥感、3D场景重构等领域的应用"
  ],
  "resolution_ids": [],
  "schema_version": 1,
  "status": "active",
  "status_observed_at": "2026-08-05T03:31:23Z",
  "status_reason": null,
  "status_source_url": "https://teacher.bupt.edu.cn/pengyuexing/zh_CN/index.htm",
  "title": "副教授",
  "updated_at": "2026-08-05T03:31:23Z"
}
