{
  "affiliations": [
    {
      "claim_ids": [
        "claim_c26d7ec2cfe823805fb6"
      ],
      "ended_at": null,
      "id": "aff_e83579564683a27e7805",
      "is_primary": true,
      "observed_at": "2026-08-21T18:54:52Z",
      "organization_id": "org_auto_b63813c60dc5d79571ca",
      "source_url": "http://xagx.zuel.edu.cn/2016/0918/c3560a397847/page.htm",
      "started_at": null,
      "status": "current",
      "title": "讲师"
    }
  ],
  "claim_ids": [
    "claim_c26d7ec2cfe823805fb6"
  ],
  "contacts": [
    {
      "affiliation_id": "aff_e83579564683a27e7805",
      "claim_ids": [
        "claim_c26d7ec2cfe823805fb6"
      ],
      "is_primary": true,
      "normalized_value": "z0001545@zuel.edu.cn",
      "observed_at": "2026-08-21T18:54:52Z",
      "source_url": "http://xagx.zuel.edu.cn/2016/0918/c3560a397847/page.htm",
      "status": "current",
      "type": "email",
      "value": "z0001545@zuel.edu.cn"
    }
  ],
  "created_at": "2026-08-21T18:54:52Z",
  "field_provenance": {
    "affiliations": [
      "claim_c26d7ec2cfe823805fb6"
    ],
    "email": [
      "claim_c26d7ec2cfe823805fb6"
    ],
    "name": [
      "claim_c26d7ec2cfe823805fb6"
    ],
    "profile_url": [
      "claim_c26d7ec2cfe823805fb6"
    ],
    "research_directions": [
      "claim_c26d7ec2cfe823805fb6"
    ],
    "status": [
      "claim_c26d7ec2cfe823805fb6"
    ],
    "title": [
      "claim_c26d7ec2cfe823805fb6"
    ]
  },
  "id": "mentor_0d78462d75cd025411af",
  "last_verified_at": "2026-08-21T18:54:52Z",
  "names": [
    {
      "claim_ids": [
        "claim_c26d7ec2cfe823805fb6"
      ],
      "is_primary": true,
      "kind": "native",
      "value": "刘琪"
    }
  ],
  "profiles": [
    {
      "affiliation_id": "aff_e83579564683a27e7805",
      "claim_ids": [
        "claim_c26d7ec2cfe823805fb6"
      ],
      "observed_at": "2026-08-21T18:54:52Z",
      "status": "current",
      "url": "http://xagx.zuel.edu.cn/2016/0918/c3560a397847/page.htm"
    }
  ],
  "recent_papers": [],
  "research_directions": [
    "计算机网络(网络工程技术)、区块链应用(物流供应链与生态链)"
  ],
  "resolution_ids": [],
  "schema_version": 1,
  "status": "active",
  "status_observed_at": "2026-08-21T18:54:52Z",
  "status_reason": null,
  "status_source_url": "http://xagx.zuel.edu.cn/2016/0918/c3560a397847/page.htm",
  "title": "讲师",
  "updated_at": "2026-08-21T18:54:52Z"
}
