{
  "affiliations": [
    {
      "claim_ids": [
        "claim_1c6522b307220314d64b"
      ],
      "ended_at": null,
      "id": "aff_7bf98668addc614c818a",
      "is_primary": true,
      "observed_at": "2026-08-22T08:27:04Z",
      "organization_id": "org_auto_a44d90661a923834917f",
      "source_url": "http://chem.nju.edu.cn/dhb/list.htm",
      "started_at": null,
      "status": "current",
      "title": "教授"
    }
  ],
  "claim_ids": [
    "claim_1c6522b307220314d64b"
  ],
  "contacts": [
    {
      "affiliation_id": "aff_7bf98668addc614c818a",
      "claim_ids": [
        "claim_1c6522b307220314d64b"
      ],
      "is_primary": true,
      "normalized_value": "hbdu@nju.edu.cn",
      "observed_at": "2026-08-22T08:27:04Z",
      "source_url": "http://chem.nju.edu.cn/dhb/list.htm",
      "status": "current",
      "type": "email",
      "value": "hbdu@nju.edu.cn"
    }
  ],
  "created_at": "2026-08-22T08:27:04Z",
  "field_provenance": {
    "affiliations": [
      "claim_1c6522b307220314d64b"
    ],
    "email": [
      "claim_1c6522b307220314d64b"
    ],
    "name": [
      "claim_1c6522b307220314d64b"
    ],
    "profile_url": [
      "claim_1c6522b307220314d64b"
    ],
    "recent_papers": [
      "claim_1c6522b307220314d64b"
    ],
    "research_directions": [
      "claim_1c6522b307220314d64b"
    ],
    "status": [
      "claim_1c6522b307220314d64b"
    ],
    "title": [
      "claim_1c6522b307220314d64b"
    ]
  },
  "id": "mentor_65ef6e96c7bc818e94b8",
  "last_verified_at": "2026-08-22T08:27:04Z",
  "names": [
    {
      "claim_ids": [
        "claim_1c6522b307220314d64b"
      ],
      "is_primary": true,
      "kind": "native",
      "value": "杜红宾"
    }
  ],
  "profiles": [
    {
      "affiliation_id": "aff_7bf98668addc614c818a",
      "claim_ids": [
        "claim_1c6522b307220314d64b"
      ],
      "observed_at": "2026-08-22T08:27:04Z",
      "status": "current",
      "url": "http://chem.nju.edu.cn/dhb/list.htm"
    }
  ],
  "recent_papers": [
    "Fei Wang, Siyu Chen, Changsheng Song, Baoxun Zhao, Hongbin Du*, Min Fang*, Solvent-induced growth of free-standing two-dimensional Si nanosheets, Small, 2020, in press.",
    "Wenwen Zi, Xianshu Cai, Feng Jiao, Hongbin Du*, Synthesis, structure and properties of an extra-large-pore aluminosilicate zeolite NUD-6, Chemistry - A European Journal, 2020, 26, in press.",
    "Wen-Wen Zi, Jun Zhang, Xian-Shu Cai, Feng Jiao, Hong-Bin Du*, Synthesis and characterization of a layered aluminosilicate NUD-11 and its transformation to a 3D stable zeolite, Dalton Trans., 2020, 49, 11682-11688.",
    "Baoxun Zhao, Changsheng Song, Fei Wang, Wenwen Zi, Hongbin Du*, Facile synthesis of microporous N-doped carbon material and its application in supercapacitor, Microporous and Mesoporous Materials, 2020, 306, 110483.",
    "Wen-Wen Zi, Zi-Hao Gao, Jun Zhang, Bao-Xun Zhao, Hong-Bin Du*, Fei-Jian Chen*, An extra-large-pore pure silica zeolite with 16x8x8-membered ring channels synthesized by using an aromatic organic directing agent, Angew. Chem. Int. Ed., 2020, 59, 3948-3951.",
    "Fei Wang, Changsheng Song, Baoxun Zhao, Lin Sun, Hongbin Du*, One-pot solution synthesis of carbon-coated silicon nanoparticles as an anode material for lithium-ion batteries, Chem. Commun., 2020, 56, 1109-1112.",
    "Wen-Wen Zi, Zi-Hao Gao, Jun Zhang, Jing-Hui Lv, Bao-Xun Zhao, Yu-Fei Jiang, Hong-Bin Du*, Fei-Jian Chen*, Designed synthesis of an extra-large pore zeolite with a 14-membered ring channel via supramolecular assembly templating approach, Microporous and Mesoporous Materials, 2019, 290, 109654.",
    "Baoxun Zhao, Changsheng Song, Fei Wang, Wenwen Zi, Hongbin Du*, Ionothermal synthesis of crystalline nanoporous silicon and its use as anode materials in lithium ion batteries, Nanoscale Research Letters, 2019, 14, 196."
  ],
  "research_directions": [
    "多孔晶体材料的晶体工程、能源存储和转化材料化学,新型多孔材料和能源材料研究"
  ],
  "resolution_ids": [],
  "schema_version": 1,
  "status": "active",
  "status_observed_at": "2026-08-22T08:27:04Z",
  "status_reason": null,
  "status_source_url": "http://chem.nju.edu.cn/dhb/list.htm",
  "title": "教授",
  "updated_at": "2026-08-22T08:27:04Z"
}
