{
  "affiliations": [
    {
      "claim_ids": [
        "claim_a2c8e151440ef5abb3e0"
      ],
      "ended_at": null,
      "id": "aff_56d6c3e9d922573fb13d",
      "is_primary": true,
      "observed_at": "2026-08-07T06:59:37Z",
      "organization_id": "org_auto_93d70925d69f4ea8f465",
      "source_url": "https://ee.jlu.edu.cn/info/1019/4525.htm",
      "started_at": null,
      "status": "current",
      "title": "副教授"
    }
  ],
  "claim_ids": [
    "claim_a2c8e151440ef5abb3e0"
  ],
  "contacts": [
    {
      "affiliation_id": "aff_56d6c3e9d922573fb13d",
      "claim_ids": [
        "claim_a2c8e151440ef5abb3e0"
      ],
      "is_primary": true,
      "normalized_value": "liushihao@jlu.edu.cn",
      "observed_at": "2026-08-07T06:59:37Z",
      "source_url": "https://ee.jlu.edu.cn/info/1019/4525.htm",
      "status": "current",
      "type": "email",
      "value": "liushihao@jlu.edu.cn"
    }
  ],
  "created_at": "2026-08-07T06:59:37Z",
  "field_provenance": {
    "affiliations": [
      "claim_a2c8e151440ef5abb3e0"
    ],
    "email": [
      "claim_a2c8e151440ef5abb3e0"
    ],
    "name": [
      "claim_a2c8e151440ef5abb3e0"
    ],
    "profile_url": [
      "claim_a2c8e151440ef5abb3e0"
    ],
    "recent_papers": [
      "claim_a2c8e151440ef5abb3e0"
    ],
    "research_directions": [
      "claim_a2c8e151440ef5abb3e0"
    ],
    "status": [
      "claim_a2c8e151440ef5abb3e0"
    ],
    "title": [
      "claim_a2c8e151440ef5abb3e0"
    ]
  },
  "id": "mentor_32d285766928cce6e093",
  "last_verified_at": "2026-08-07T06:59:37Z",
  "names": [
    {
      "claim_ids": [
        "claim_a2c8e151440ef5abb3e0"
      ],
      "is_primary": true,
      "kind": "native",
      "value": "刘士浩"
    }
  ],
  "profiles": [
    {
      "affiliation_id": "aff_56d6c3e9d922573fb13d",
      "claim_ids": [
        "claim_a2c8e151440ef5abb3e0"
      ],
      "observed_at": "2026-08-07T06:59:37Z",
      "status": "current",
      "url": "https://ee.jlu.edu.cn/info/1019/4525.htm"
    }
  ],
  "recent_papers": [
    "Jingyu Peng†, Xulan Xue†, Shihao Liu†, Yingguo Yang*, Tianqi Yang, Bingyan Zhu, Xin Wang, Hanzhuang Zhang, Wenfa Xie*, Gengsheng Chen, Shanglei Feng, Lina Li, Renzhong Tai, Aiwei Tang*, Haizhou Lu*, Wenyu Ji*, “Maximizing perovskite electroluminescence with ordered 3D/2D heterojunction”,Nature, 2026, 651, 76-82.",
    "Mengxin Xu, Meina Han, Minying Xue, Shihao Liu*, Yi Li, Gaoqiang Deng, Letian Zhang, Yuantao Zhang, Gang Cheng*, Wenfa Xie*, Chi‐Ming Che*, “High‐Performance Flexible Near‐Infrared Organic Light‐Emitting Diodes with a Heterogeneous Alloy Semitransparent Electrode”,Adv. Mater., 2026, e18212.",
    "Song Wang†, Shihao Liu†, Ting Wang, Jialin Bai, Jingyu Peng, Hanzhuang Zhang*, Wenfa Xie*, Wenyu Ji*, “Operando ZnO recrystallization for efficient quantum-dot light-emitting diodes”,Light. Sci. Appl., 2025, 14, 196.",
    "Long Chen, Yuanhe Wang, Yanlong Wen, Letian Zhang*, Shihao Liu*, Wenfa Xie*, “Organic photoplethysmography sensors for wearable health monitoring”,Laser Photonics Rev., 2025, 19, 2401992.",
    "Hejian Zhou, Xiaoxiao Zhuang, Mengxin Xu, Shihao Liu*, Letian Zhang*, Wenfa Xie*, “AC‐driven color‐tunable white organic light‐emitting diodes with micron‐scale patterned carrier transport layers”,Laser Photonics Rev., 2025, 19, 2401884.",
    "Jiaming Zhang, Yanlong Wen, Meina Han, Letian Zhang, Shihao Liu, Wenfa Xie, Cunjiang Yu, “A dynamic hybrid luminescent display for multilevel anticounterfeiting”,Laser Photonics Rev., 2025, 19, 2400895.",
    "Taiying Zhou, Ting Wang, Jialin Bai, Shihao Liu*, Hanzhuang Zhang, Wenfa Xie*, Wenyu Ji*, “High-performance tandem quantum-dot light-emitting diodes based on bulk-heterojunction-like charge-generation layers”,Adv. Mater., 2024, 36, 2313888.",
    "Hao Zhu, Hongwei Yu, Jiaming Zhang, Yiqi Zhang, Letian Zhang*, Shihao Liu*, Wenfa Xie*, “Organic photoplethysmography sensor based on directional emission microcavity organic light-emitting device”,Laser Photonics Rev., 2024, 59, 2400042."
  ],
  "research_directions": [
    "薄膜电致发光器件:器件结构、物理与应用"
  ],
  "resolution_ids": [],
  "schema_version": 1,
  "status": "active",
  "status_observed_at": "2026-08-07T06:59:37Z",
  "status_reason": null,
  "status_source_url": "https://ee.jlu.edu.cn/info/1019/4525.htm",
  "title": "副教授",
  "updated_at": "2026-08-07T06:59:37Z"
}
