{
  "affiliations": [
    {
      "claim_ids": [
        "claim_98450a8c7b5617682e35"
      ],
      "ended_at": null,
      "id": "aff_5c33f817690d60528fc1",
      "is_primary": true,
      "observed_at": "2026-08-21T18:44:05Z",
      "organization_id": "org_auto_ac6af5d06d7a9749dcfc",
      "source_url": "https://www.auto.uestc.edu.cn/info/1156/7223.htm",
      "started_at": null,
      "status": "current",
      "title": null
    }
  ],
  "claim_ids": [
    "claim_98450a8c7b5617682e35"
  ],
  "contacts": [
    {
      "affiliation_id": "aff_5c33f817690d60528fc1",
      "claim_ids": [
        "claim_98450a8c7b5617682e35"
      ],
      "is_primary": true,
      "normalized_value": "gaottaa@uestc.edu.cn",
      "observed_at": "2026-08-21T18:44:05Z",
      "source_url": "https://www.auto.uestc.edu.cn/info/1156/7223.htm",
      "status": "current",
      "type": "email",
      "value": "gaottaa@uestc.edu.cn"
    }
  ],
  "created_at": "2026-08-21T18:44:05Z",
  "field_provenance": {
    "affiliations": [
      "claim_98450a8c7b5617682e35"
    ],
    "email": [
      "claim_98450a8c7b5617682e35"
    ],
    "name": [
      "claim_98450a8c7b5617682e35"
    ],
    "profile_url": [
      "claim_98450a8c7b5617682e35"
    ],
    "research_directions": [
      "claim_98450a8c7b5617682e35"
    ],
    "status": [
      "claim_98450a8c7b5617682e35"
    ]
  },
  "id": "mentor_6a99294e2bc6f0b9d883",
  "last_verified_at": "2026-08-21T18:44:05Z",
  "names": [
    {
      "claim_ids": [
        "claim_98450a8c7b5617682e35"
      ],
      "is_primary": true,
      "kind": "native",
      "value": "高婷婷"
    }
  ],
  "profiles": [
    {
      "affiliation_id": "aff_5c33f817690d60528fc1",
      "claim_ids": [
        "claim_98450a8c7b5617682e35"
      ],
      "observed_at": "2026-08-21T18:44:05Z",
      "status": "current",
      "url": "https://www.auto.uestc.edu.cn/info/1156/7223.htm"
    }
  ],
  "recent_papers": [],
  "research_directions": [
    "非线性系统的自适应约束控制"
  ],
  "resolution_ids": [],
  "schema_version": 1,
  "status": "active",
  "status_observed_at": "2026-08-21T18:44:05Z",
  "status_reason": null,
  "status_source_url": "https://www.auto.uestc.edu.cn/info/1156/7223.htm",
  "title": null,
  "updated_at": "2026-08-21T18:44:05Z"
}
