{
  "affiliations": [
    {
      "claim_ids": [
        "claim_911bb071e87c2f4d1524"
      ],
      "ended_at": null,
      "id": "aff_5a6685c40a83b8ca0e11",
      "is_primary": true,
      "observed_at": "2026-08-21T18:54:04Z",
      "organization_id": "org_auto_7ca12e0d0207fa068635",
      "source_url": "https://law.zuel.edu.cn/2025/0525/c16276a395589/page.htm",
      "started_at": null,
      "status": "current",
      "title": "副教授"
    }
  ],
  "claim_ids": [
    "claim_911bb071e87c2f4d1524"
  ],
  "contacts": [
    {
      "affiliation_id": "aff_5a6685c40a83b8ca0e11",
      "claim_ids": [
        "claim_911bb071e87c2f4d1524"
      ],
      "is_primary": true,
      "normalized_value": "1009700321@qq.com",
      "observed_at": "2026-08-21T18:54:04Z",
      "source_url": "https://law.zuel.edu.cn/2025/0525/c16276a395589/page.htm",
      "status": "current",
      "type": "email",
      "value": "1009700321@qq.com"
    }
  ],
  "created_at": "2026-08-21T18:54:04Z",
  "field_provenance": {
    "affiliations": [
      "claim_911bb071e87c2f4d1524"
    ],
    "email": [
      "claim_911bb071e87c2f4d1524"
    ],
    "name": [
      "claim_911bb071e87c2f4d1524"
    ],
    "profile_url": [
      "claim_911bb071e87c2f4d1524"
    ],
    "recent_papers": [
      "claim_911bb071e87c2f4d1524"
    ],
    "research_directions": [
      "claim_911bb071e87c2f4d1524"
    ],
    "status": [
      "claim_911bb071e87c2f4d1524"
    ],
    "title": [
      "claim_911bb071e87c2f4d1524"
    ]
  },
  "id": "mentor_8dbb06f261601d6c4840",
  "last_verified_at": "2026-08-21T18:54:04Z",
  "names": [
    {
      "claim_ids": [
        "claim_911bb071e87c2f4d1524"
      ],
      "is_primary": true,
      "kind": "native",
      "value": "张硕"
    }
  ],
  "profiles": [
    {
      "affiliation_id": "aff_5a6685c40a83b8ca0e11",
      "claim_ids": [
        "claim_911bb071e87c2f4d1524"
      ],
      "observed_at": "2026-08-21T18:54:04Z",
      "status": "current",
      "url": "https://law.zuel.edu.cn/2025/0525/c16276a395589/page.htm"
    }
  ],
  "recent_papers": [
    "《求索行政法学研究的比较历史解释之路——评倪洪涛教授〈新行政法释论〉》,载《时代法学》2025年第1期。",
    "《“化解行政争议的主渠道”定位下复议证据制度之调适》,载《法学》2024年第12期。",
    "《人民司法中的全过程人民民主:传承、创新与发展方向》,载《武汉大学学报(哲学社会科学版)》2022年第6期。",
    "《行政诉讼中的裁判事实如何生成?——基于事实认知层次的分析》,载《法制与社会发展》2022年第4期。",
    "《监察案件非法证据排除制度体系:法理解构与实践路径》,载《政法论坛》2020年第6期。",
    "《监察过程中的公安协助配合机制》,载《法学研究》2019年第2期。(第二作者)",
    "《论行政非法取证行为程序性制裁——兼评<行政诉讼法>第43条第3款》,载《河北法学》2018年第9期。",
    "《行政诉讼非法证据排除规则适用的困境与出路——以218份裁判文书为样本》,载《行政法学研究》2018年第4期。"
  ],
  "research_directions": [
    "证据法学、司法文明"
  ],
  "resolution_ids": [],
  "schema_version": 1,
  "status": "active",
  "status_observed_at": "2026-08-21T18:54:04Z",
  "status_reason": null,
  "status_source_url": "https://law.zuel.edu.cn/2025/0525/c16276a395589/page.htm",
  "title": "副教授",
  "updated_at": "2026-08-21T18:54:04Z"
}
