{
  "affiliations": [
    {
      "claim_ids": [
        "claim_fd6f89423c8418f83c4e"
      ],
      "ended_at": null,
      "id": "aff_1d6e71f7979aa6755188",
      "is_primary": true,
      "observed_at": "2026-08-21T18:44:44Z",
      "organization_id": "org_auto_518298dcc9dcb1ad8413",
      "source_url": "https://hxxy.neau.edu.cn/info/1142/1492.htm",
      "started_at": null,
      "status": "current",
      "title": "副教授"
    }
  ],
  "claim_ids": [
    "claim_fd6f89423c8418f83c4e"
  ],
  "contacts": [
    {
      "affiliation_id": "aff_1d6e71f7979aa6755188",
      "claim_ids": [
        "claim_fd6f89423c8418f83c4e"
      ],
      "is_primary": true,
      "normalized_value": "yaoshunyu@neau.edu.cn",
      "observed_at": "2026-08-21T18:44:44Z",
      "source_url": "https://hxxy.neau.edu.cn/info/1142/1492.htm",
      "status": "current",
      "type": "email",
      "value": "yaoshunyu@neau.edu.cn"
    }
  ],
  "created_at": "2026-08-21T18:44:44Z",
  "field_provenance": {
    "affiliations": [
      "claim_fd6f89423c8418f83c4e"
    ],
    "email": [
      "claim_fd6f89423c8418f83c4e"
    ],
    "name": [
      "claim_fd6f89423c8418f83c4e"
    ],
    "profile_url": [
      "claim_fd6f89423c8418f83c4e"
    ],
    "recent_papers": [
      "claim_fd6f89423c8418f83c4e"
    ],
    "research_directions": [
      "claim_fd6f89423c8418f83c4e"
    ],
    "status": [
      "claim_fd6f89423c8418f83c4e"
    ],
    "title": [
      "claim_fd6f89423c8418f83c4e"
    ]
  },
  "id": "mentor_a0433d5d116f249b3e03",
  "last_verified_at": "2026-08-21T18:44:44Z",
  "names": [
    {
      "claim_ids": [
        "claim_fd6f89423c8418f83c4e"
      ],
      "is_primary": true,
      "kind": "native",
      "value": "姚舜禹"
    }
  ],
  "profiles": [
    {
      "affiliation_id": "aff_1d6e71f7979aa6755188",
      "claim_ids": [
        "claim_fd6f89423c8418f83c4e"
      ],
      "observed_at": "2026-08-21T18:44:44Z",
      "status": "current",
      "url": "https://hxxy.neau.edu.cn/info/1142/1492.htm"
    }
  ],
  "recent_papers": [
    "Recent advances in metal-organic frameworks based on electrospinning for energy storage",
    "Lattice strain engineering of CoOOH induced by NiMn-MOF for high-efficiency supercapacitor and water oxidation electrocatalysis",
    "Vertically co-oriented Mn-metal–organic framework grown on 2D cation-intercalated manganese oxide via a self-sacrificing template process for a high-performance asymmetric supercapacitor",
    "Hierarchical WO3@MnWO4core-shell structure for asymmetric supercapacitor with ultrahigh cycling performance at low temperature",
    "Flexible electrode materials based on WO3nanotube bundles for high performance energy storage devices"
  ],
  "research_directions": [
    "电化学储能与催化、纳米酶检测、复合材料构筑"
  ],
  "resolution_ids": [],
  "schema_version": 1,
  "status": "active",
  "status_observed_at": "2026-08-21T18:44:44Z",
  "status_reason": null,
  "status_source_url": "https://hxxy.neau.edu.cn/info/1142/1492.htm",
  "title": "副教授",
  "updated_at": "2026-08-21T18:44:44Z"
}
