{
  "affiliations": [
    {
      "claim_ids": [
        "claim_b978661cf75ff7ee0b34"
      ],
      "ended_at": null,
      "id": "aff_be7b76d00e0709293d34",
      "is_primary": true,
      "observed_at": "2026-08-12T07:26:28Z",
      "organization_id": "org_auto_b3c41cb2017552a01745",
      "source_url": "https://faculty.xidian.edu.cn/zhenglele/zh_CN/index.htm",
      "started_at": null,
      "status": "current",
      "title": "助理研究员"
    }
  ],
  "claim_ids": [
    "claim_b978661cf75ff7ee0b34"
  ],
  "contacts": [
    {
      "affiliation_id": "aff_be7b76d00e0709293d34",
      "claim_ids": [
        "claim_b978661cf75ff7ee0b34"
      ],
      "is_primary": true,
      "normalized_value": "zhenglele@xidian.edu.cn",
      "observed_at": "2026-08-12T07:26:28Z",
      "source_url": "https://faculty.xidian.edu.cn/zhenglele/zh_CN/index.htm",
      "status": "current",
      "type": "email",
      "value": "zhenglele@xidian.edu.cn"
    }
  ],
  "created_at": "2026-08-12T07:26:28Z",
  "field_provenance": {
    "affiliations": [
      "claim_b978661cf75ff7ee0b34"
    ],
    "email": [
      "claim_b978661cf75ff7ee0b34"
    ],
    "name": [
      "claim_b978661cf75ff7ee0b34"
    ],
    "profile_url": [
      "claim_b978661cf75ff7ee0b34"
    ],
    "research_directions": [
      "claim_b978661cf75ff7ee0b34"
    ],
    "status": [
      "claim_b978661cf75ff7ee0b34"
    ],
    "title": [
      "claim_b978661cf75ff7ee0b34"
    ]
  },
  "id": "mentor_7331444ddef7779398e0",
  "last_verified_at": "2026-08-12T07:26:28Z",
  "names": [
    {
      "claim_ids": [
        "claim_b978661cf75ff7ee0b34"
      ],
      "is_primary": true,
      "kind": "native",
      "value": "郑乐乐"
    }
  ],
  "profiles": [
    {
      "affiliation_id": "aff_be7b76d00e0709293d34",
      "claim_ids": [
        "claim_b978661cf75ff7ee0b34"
      ],
      "observed_at": "2026-08-12T07:26:28Z",
      "status": "current",
      "url": "https://faculty.xidian.edu.cn/zhenglele/zh_CN/index.htm"
    }
  ],
  "recent_papers": [],
  "research_directions": [
    "差分隐私,大语言模型安全、数据安全与隐私保护"
  ],
  "resolution_ids": [],
  "schema_version": 1,
  "status": "active",
  "status_observed_at": "2026-08-12T07:26:28Z",
  "status_reason": null,
  "status_source_url": "https://faculty.xidian.edu.cn/zhenglele/zh_CN/index.htm",
  "title": "助理研究员",
  "updated_at": "2026-08-12T07:26:28Z"
}
