{
  "affiliations": [
    {
      "claim_ids": [
        "claim_bea8028e82cbcb130fbf"
      ],
      "ended_at": null,
      "id": "aff_d4085771db4e60803a2e",
      "is_primary": true,
      "observed_at": "2026-08-12T07:26:28Z",
      "organization_id": "org_auto_b3c41cb2017552a01745",
      "source_url": "https://faculty.xidian.edu.cn/ZHUXINGHUI/zh_CN/index.htm",
      "started_at": null,
      "status": "current",
      "title": null
    }
  ],
  "claim_ids": [
    "claim_bea8028e82cbcb130fbf"
  ],
  "contacts": [
    {
      "affiliation_id": "aff_d4085771db4e60803a2e",
      "claim_ids": [
        "claim_bea8028e82cbcb130fbf"
      ],
      "is_primary": true,
      "normalized_value": "xhzhu@xidian.edu.cn",
      "observed_at": "2026-08-12T07:26:28Z",
      "source_url": "https://faculty.xidian.edu.cn/ZHUXINGHUI/zh_CN/index.htm",
      "status": "current",
      "type": "email",
      "value": "xhzhu@xidian.edu.cn"
    }
  ],
  "created_at": "2026-08-12T07:26:28Z",
  "field_provenance": {
    "affiliations": [
      "claim_bea8028e82cbcb130fbf"
    ],
    "email": [
      "claim_bea8028e82cbcb130fbf"
    ],
    "name": [
      "claim_bea8028e82cbcb130fbf"
    ],
    "profile_url": [
      "claim_bea8028e82cbcb130fbf"
    ],
    "research_directions": [
      "claim_bea8028e82cbcb130fbf"
    ],
    "status": [
      "claim_bea8028e82cbcb130fbf"
    ]
  },
  "id": "mentor_df1bafee8615b3187bbd",
  "last_verified_at": "2026-08-12T07:26:28Z",
  "names": [
    {
      "claim_ids": [
        "claim_bea8028e82cbcb130fbf"
      ],
      "is_primary": true,
      "kind": "native",
      "value": "祝幸辉"
    }
  ],
  "profiles": [
    {
      "affiliation_id": "aff_d4085771db4e60803a2e",
      "claim_ids": [
        "claim_bea8028e82cbcb130fbf"
      ],
      "observed_at": "2026-08-12T07:26:28Z",
      "status": "current",
      "url": "https://faculty.xidian.edu.cn/ZHUXINGHUI/zh_CN/index.htm"
    }
  ],
  "recent_papers": [],
  "research_directions": [
    "物联网及安全"
  ],
  "resolution_ids": [],
  "schema_version": 1,
  "status": "active",
  "status_observed_at": "2026-08-12T07:26:28Z",
  "status_reason": null,
  "status_source_url": "https://faculty.xidian.edu.cn/ZHUXINGHUI/zh_CN/index.htm",
  "title": null,
  "updated_at": "2026-08-12T07:26:28Z"
}
