{
  "affiliations": [
    {
      "claim_ids": [
        "claim_0110dc9b5efd6993f471"
      ],
      "ended_at": null,
      "id": "aff_d361df95f54fabfd8dbb",
      "is_primary": true,
      "observed_at": "2026-08-21T18:45:03Z",
      "organization_id": "org_auto_b975896d77c59e7ecc1a",
      "source_url": "https://ccds.fzu.edu.cn/info/1203/5176.htm",
      "started_at": null,
      "status": "current",
      "title": null
    }
  ],
  "claim_ids": [
    "claim_0110dc9b5efd6993f471"
  ],
  "contacts": [
    {
      "affiliation_id": "aff_d361df95f54fabfd8dbb",
      "claim_ids": [
        "claim_0110dc9b5efd6993f471"
      ],
      "is_primary": true,
      "normalized_value": "lzh@fzu.edu.cn",
      "observed_at": "2026-08-21T18:45:03Z",
      "source_url": "https://ccds.fzu.edu.cn/info/1203/5176.htm",
      "status": "current",
      "type": "email",
      "value": "lzh@fzu.edu.cn"
    }
  ],
  "created_at": "2026-08-21T18:45:03Z",
  "field_provenance": {
    "affiliations": [
      "claim_0110dc9b5efd6993f471"
    ],
    "email": [
      "claim_0110dc9b5efd6993f471"
    ],
    "name": [
      "claim_0110dc9b5efd6993f471"
    ],
    "profile_url": [
      "claim_0110dc9b5efd6993f471"
    ],
    "recent_papers": [
      "claim_0110dc9b5efd6993f471"
    ],
    "research_directions": [
      "claim_0110dc9b5efd6993f471"
    ],
    "status": [
      "claim_0110dc9b5efd6993f471"
    ]
  },
  "id": "mentor_da1d755afe63cb06e10c",
  "last_verified_at": "2026-08-21T18:45:03Z",
  "names": [
    {
      "claim_ids": [
        "claim_0110dc9b5efd6993f471"
      ],
      "is_primary": true,
      "kind": "native",
      "value": "刘漳辉"
    }
  ],
  "profiles": [
    {
      "affiliation_id": "aff_d361df95f54fabfd8dbb",
      "claim_ids": [
        "claim_0110dc9b5efd6993f471"
      ],
      "observed_at": "2026-08-21T18:45:03Z",
      "status": "current",
      "url": "https://ccds.fzu.edu.cn/info/1203/5176.htm"
    }
  ],
  "recent_papers": [
    "Zhanghui Liu, Lixian Chen, Zheyi Chen*, Yifan Huang, Jie Liang, Zhengxin Yu, Wang Miao. Load Prediction in Edge Computing Using Deep Auto-Regressive Recurrent Networks, IEEE 2023 IEEE International Conference on Communications (ICC2023):809-814,CCF-C类;",
    "Shide Du , Zhanghui Liu, Zhaoliang Chen , Wenyuan Yang , and Shiping Wang*. Differentiable Bi-Sparse Multi-View Co-Clustering.IEEE TRANSACTIONS ON SIGNAL PROCESSING,2021,vol.69,4623-4636,IF:4.875;",
    "Zhanghui Liu, Yuzhong Zhang, Yuzhong Chen*, Xinwen Fan, Chen Dong. Detection of Algorithmically Generated Domain Names Using the Recurrent Convolutional Neural Network with Spatial Pyramid Pooling. Entropy, 2020, 22(9), 1058,IF:2.524;",
    "刘漳辉,占小路,陈羽中*.基于语义传播与前/背景感知的图像语义分割网络[J].模式识别与人工智能,2022,35(1):71-81;",
    "Zhanghui Liu, Bingjie Xiang, Wenzhong Guo, Yuzhong Chen, Kun Guo*, Jianning Zheng. Overlapping Community Detection Algorithm Based on Coarsening and Local Overlapping Modularity. IEEE Access 7: 57943-57955, 2019,IF:3.745;",
    "刘漳辉,杨耀东,陈羽中*.一种用于方面级情感分析的关系注意力图卷积网络[J].小型微型计算机系统,2023,44(04):752-758;",
    "Z Liu,T Xiang,B Lin,X Ye,H Wang,Y Zhang,X Chen*. A data placement strategy for scientific workflow in hybrid cloud. 2018 IEEE 11th International Conference on Cloud Computing (IEEE CLOUD): 556-563,CCF C类;",
    "Zhang-Hui Liu, Guo-Long Chen*, Ning-Ning Wang, Biao Song, Greedy immunization strategy in weighted scale-free networks, Engineering Computations, 31(8), pp. 1627-1634, 2014, IF:1.495."
  ],
  "research_directions": [
    "数据挖掘技术、智能计算"
  ],
  "resolution_ids": [],
  "schema_version": 1,
  "status": "active",
  "status_observed_at": "2026-08-21T18:45:03Z",
  "status_reason": null,
  "status_source_url": "https://ccds.fzu.edu.cn/info/1203/5176.htm",
  "title": null,
  "updated_at": "2026-08-21T18:45:03Z"
}
