{
  "affiliations": [
    {
      "claim_ids": [
        "claim_ff97e33820963dcb913e"
      ],
      "ended_at": null,
      "id": "aff_a250448acbafa29a4981",
      "is_primary": true,
      "observed_at": "2026-08-19T06:59:51Z",
      "organization_id": "org_auto_3a18b948ae6bb2e5600a",
      "source_url": "https://soai.sjtu.edu.cn/cn/facultydetails/zzjs/wenmuning",
      "started_at": null,
      "status": "current",
      "title": "助理研究员"
    }
  ],
  "claim_ids": [
    "claim_ff97e33820963dcb913e"
  ],
  "contacts": [
    {
      "affiliation_id": "aff_a250448acbafa29a4981",
      "claim_ids": [
        "claim_ff97e33820963dcb913e"
      ],
      "is_primary": true,
      "normalized_value": "muningwen@sjtu.edu.cn",
      "observed_at": "2026-08-19T06:59:51Z",
      "source_url": "https://soai.sjtu.edu.cn/cn/facultydetails/zzjs/wenmuning",
      "status": "current",
      "type": "email",
      "value": "muningwen@sjtu.edu.cn"
    }
  ],
  "created_at": "2026-08-19T06:59:51Z",
  "field_provenance": {
    "affiliations": [
      "claim_ff97e33820963dcb913e"
    ],
    "email": [
      "claim_ff97e33820963dcb913e"
    ],
    "name": [
      "claim_ff97e33820963dcb913e"
    ],
    "profile_url": [
      "claim_ff97e33820963dcb913e"
    ],
    "research_directions": [
      "claim_ff97e33820963dcb913e"
    ],
    "status": [
      "claim_ff97e33820963dcb913e"
    ],
    "title": [
      "claim_ff97e33820963dcb913e"
    ]
  },
  "id": "mentor_85ea51da91611c4a792e",
  "last_verified_at": "2026-08-19T06:59:51Z",
  "names": [
    {
      "claim_ids": [
        "claim_ff97e33820963dcb913e"
      ],
      "is_primary": true,
      "kind": "native",
      "value": "温睦宁"
    }
  ],
  "profiles": [
    {
      "affiliation_id": "aff_a250448acbafa29a4981",
      "claim_ids": [
        "claim_ff97e33820963dcb913e"
      ],
      "observed_at": "2026-08-19T06:59:51Z",
      "status": "current",
      "url": "https://soai.sjtu.edu.cn/cn/facultydetails/zzjs/wenmuning"
    }
  ],
  "recent_papers": [],
  "research_directions": [
    "强化学习,大模型智能体以及多智能体系统"
  ],
  "resolution_ids": [],
  "schema_version": 1,
  "status": "active",
  "status_observed_at": "2026-08-19T06:59:51Z",
  "status_reason": null,
  "status_source_url": "https://soai.sjtu.edu.cn/cn/facultydetails/zzjs/wenmuning",
  "title": "助理研究员",
  "updated_at": "2026-08-19T06:59:51Z"
}
