{
  "affiliations": [
    {
      "claim_ids": [
        "claim_8a0c7981e0df3d0f5a12"
      ],
      "ended_at": null,
      "id": "aff_87b35f75c327b6ae2eb8",
      "is_primary": true,
      "observed_at": "2026-08-21T18:54:57Z",
      "organization_id": "org_auto_3f30d74b1944a64f91d2",
      "source_url": "https://seit.sysu.edu.cn/teacher/MengXiangyu",
      "started_at": null,
      "status": "current",
      "title": "副教授"
    }
  ],
  "claim_ids": [
    "claim_8a0c7981e0df3d0f5a12"
  ],
  "contacts": [
    {
      "affiliation_id": "aff_87b35f75c327b6ae2eb8",
      "claim_ids": [
        "claim_8a0c7981e0df3d0f5a12"
      ],
      "is_primary": true,
      "normalized_value": "mengxy26@mail.sysu.edu.cn",
      "observed_at": "2026-08-21T18:54:57Z",
      "source_url": "https://seit.sysu.edu.cn/teacher/MengXiangyu",
      "status": "current",
      "type": "email",
      "value": "mengxy26@mail.sysu.edu.cn"
    }
  ],
  "created_at": "2026-08-21T18:54:57Z",
  "field_provenance": {
    "affiliations": [
      "claim_8a0c7981e0df3d0f5a12"
    ],
    "email": [
      "claim_8a0c7981e0df3d0f5a12"
    ],
    "name": [
      "claim_8a0c7981e0df3d0f5a12"
    ],
    "profile_url": [
      "claim_8a0c7981e0df3d0f5a12"
    ],
    "recent_papers": [
      "claim_8a0c7981e0df3d0f5a12"
    ],
    "research_directions": [
      "claim_8a0c7981e0df3d0f5a12"
    ],
    "status": [
      "claim_8a0c7981e0df3d0f5a12"
    ],
    "title": [
      "claim_8a0c7981e0df3d0f5a12"
    ]
  },
  "id": "mentor_2aff3b6fc93954f88e03",
  "last_verified_at": "2026-08-21T18:54:57Z",
  "names": [
    {
      "claim_ids": [
        "claim_8a0c7981e0df3d0f5a12"
      ],
      "is_primary": true,
      "kind": "native",
      "value": "孟祥雨"
    }
  ],
  "profiles": [
    {
      "affiliation_id": "aff_87b35f75c327b6ae2eb8",
      "claim_ids": [
        "claim_8a0c7981e0df3d0f5a12"
      ],
      "observed_at": "2026-08-21T18:54:57Z",
      "status": "current",
      "url": "https://seit.sysu.edu.cn/teacher/MengXiangyu"
    }
  ],
  "recent_papers": [
    "A Compact 1–11-GHz 106.7-ps CMOS Passive True Time Delay Chain Implemented by Spiral Transmission Lines, in IEEE Transactions on Microwave Theory and Techniques. (Early Access)",
    "A 3.3-V Ku-Band Front-End Module with 2.6-dB NF and 18.9-dBm OP1dB in 65-nm CMOS, in IEEE Transactions on Circuits and Systems II: Express Briefs. (Early Access)",
    "An Ultra-compact DC-20 GHz NMOS-based CMOS Attenuator, in IEEE Microwave and Wireless Technology Letters. (Early Access)",
    "A Compact 3–20-GHz 106-ps Passive True-Time Delay Circuit in 65-nm CMOS, in IEEE Microwave and Wireless Technology Letters, vol. 34, no. 5, pp. 493-496, May 2024.",
    "A Ku-Band 3.3-V LNA With Multicoupled Q-Enhancement Transformer and Current-Reuse Techniques in 65-nm CMOS, in IEEE Microwave and Wireless Technology Letters, vol. 34, no. 2, pp. 195-198, Feb. 2024.",
    "A 22.5-37.8GHz Dual-Mode Class-F VCO with an Implicit Multiplier in 65-nm CMOS, 2023 16th UK-Europe-China Workshop on Millimetre Waves and Terahertz Technologies (UCMMT), Guangzhou, China, 2023, pp. 1-4.",
    "A Compact 2GHz LNA with Multi-Coupled Inductors for LFEM Application in 65nm CMOS, 2023 IEEE International Conference on Integrated Circuits, Technologies and Applications (ICTA), Hefei, China, 2023, pp. 5-8.",
    "An Adaptive RFIC Layout Generator with DRC Violations Self-repair Strategy, 2023 IEEE MTT-S International Wireless Symposium (IWS), Qingdao, China, 2023, pp. 1-3."
  ],
  "research_directions": [
    "硅基毫米波及太赫兹通信集成电路技术、集成电路EDA技术"
  ],
  "resolution_ids": [],
  "schema_version": 1,
  "status": "active",
  "status_observed_at": "2026-08-21T18:54:57Z",
  "status_reason": null,
  "status_source_url": "https://seit.sysu.edu.cn/teacher/MengXiangyu",
  "title": "副教授",
  "updated_at": "2026-08-21T18:54:57Z"
}
