{
  "affiliations": [
    {
      "claim_ids": [
        "claim_932d2b9c9210f9020aa1"
      ],
      "ended_at": null,
      "id": "aff_7a7af80a38fa028bfa2a",
      "is_primary": true,
      "observed_at": "2026-08-21T18:52:53Z",
      "organization_id": "org_auto_2a700b1866f6962f0038",
      "source_url": "https://jidian.cug.edu.cn/info/3071/30501.htm",
      "started_at": null,
      "status": "current",
      "title": "副教授"
    }
  ],
  "claim_ids": [
    "claim_932d2b9c9210f9020aa1"
  ],
  "contacts": [
    {
      "affiliation_id": "aff_7a7af80a38fa028bfa2a",
      "claim_ids": [
        "claim_932d2b9c9210f9020aa1"
      ],
      "is_primary": true,
      "normalized_value": "lichangpingcug@126.com",
      "observed_at": "2026-08-21T18:52:53Z",
      "source_url": "https://jidian.cug.edu.cn/info/3071/30501.htm",
      "status": "current",
      "type": "email",
      "value": "lichangpingcug@126.com"
    }
  ],
  "created_at": "2026-08-21T18:52:53Z",
  "field_provenance": {
    "affiliations": [
      "claim_932d2b9c9210f9020aa1"
    ],
    "email": [
      "claim_932d2b9c9210f9020aa1"
    ],
    "name": [
      "claim_932d2b9c9210f9020aa1"
    ],
    "profile_url": [
      "claim_932d2b9c9210f9020aa1"
    ],
    "recent_papers": [
      "claim_932d2b9c9210f9020aa1"
    ],
    "research_directions": [
      "claim_932d2b9c9210f9020aa1"
    ],
    "status": [
      "claim_932d2b9c9210f9020aa1"
    ],
    "title": [
      "claim_932d2b9c9210f9020aa1"
    ]
  },
  "id": "mentor_83e4aed93e8ab5ae3164",
  "last_verified_at": "2026-08-21T18:52:53Z",
  "names": [
    {
      "claim_ids": [
        "claim_932d2b9c9210f9020aa1"
      ],
      "is_primary": true,
      "kind": "native",
      "value": "李昌平"
    }
  ],
  "profiles": [
    {
      "affiliation_id": "aff_7a7af80a38fa028bfa2a",
      "claim_ids": [
        "claim_932d2b9c9210f9020aa1"
      ],
      "observed_at": "2026-08-21T18:52:53Z",
      "status": "current",
      "url": "https://jidian.cug.edu.cn/info/3071/30501.htm"
    }
  ],
  "recent_papers": [
    "Liu Xianao, Longchen Duan,Changping Li*(通讯作者), JifengKang, Di Zhang.Simulation and Experimental Study on the Rock-Breaking Process Induced by High-Voltage Electric Pulse[J].Rock Mechanics and Rock Engineering, 2024, :1-21. (SCI/EI).",
    "Longchen Duan,Liu Xianao,Changping Li*(通讯作者), Jifeng Kang, Di Zhang.Research on the Effects of an Electrode Drill Bit during the Rock Drilling Process by High-Voltage ElectricPulse[J].SPE Journal , 2024. (SCI/EI).",
    "Changping Li, Wenjian Yang. Prediction model of high-voltage pulse boring rock-breaking process and intelligent identification of model parameters [J]. Journal of Petroleum Science and Engineering, 2022, 210: 110066.(SCI/EI).",
    "Longchen Duan, Yibiao Xiao,Changping Li*(通讯作者), Ao Li, Jifeng Kang.Simulation and Experimental Study On the Influence of Bit Structure On Rock-Breaking by High-Voltage Electro-Pulse Boring[J]. Journal of Petroleum Science and Engineering, 2022, 214:110556. (SCI/EI).",
    "Changping Li, Longchen Duan, Jifeng Kang, Ao Li, Yibiao Xiao. Experimental investigation on rock-breaking by high-voltage electro-pulse boring [J]. Journal of Energy Resources Technology, 2022, 144:123009. (SCI/EI)",
    "Changping Li, Longchen Duan, Jifeng Kang, AoLi,Yibiao Xiao, Victor Chikhotkin. Weight analysis and experimental study on influencing factors of high-voltage electro-pulse boring [J]. Journal of Petroleum Science and Engineering, 2021, 205: 108807. (SCI/EI).",
    "Changping Li, Longchen Duan, Laijie Wu, Songcheng Tan, Jun Zheng, Victor Chikhotkin. Optimization of discharge circuit model based on electro pulse boring experiment[J]. Journal of Natural Gas Science and Engineering, 2021, 86: 103730. (SCI/EI).",
    "Changping Li, Longchen Duan, Laijie Wu, Songcheng Tan, Jun Zheng, Victor Chikhotkin. Experimental and Numerical Analyses of Electro-Pulse Rock-Breaking Drilling [J]. Journal of Natural Gas Science and Engineering. 2020, 77: 103263. (SCI/EI)."
  ],
  "research_directions": [
    "智能地质装备:智能高效钻探装备、地质装备自动化与智能化、地质装备绿色设计与制造",
    "自动化与人工智能:机器学习、深度学习、智能控制算法、工业控制、机电产品设计"
  ],
  "resolution_ids": [],
  "schema_version": 1,
  "status": "active",
  "status_observed_at": "2026-08-21T18:52:53Z",
  "status_reason": null,
  "status_source_url": "https://jidian.cug.edu.cn/info/3071/30501.htm",
  "title": "副教授",
  "updated_at": "2026-08-21T18:52:53Z"
}
