{
  "affiliations": [
    {
      "claim_ids": [
        "claim_44c66506175b27bba1b0"
      ],
      "ended_at": null,
      "id": "aff_ebffddf1c0733253e0aa",
      "is_primary": true,
      "observed_at": "2026-08-21T18:46:55Z",
      "organization_id": "org_auto_d2c959c592bfc3959175",
      "source_url": "https://faculty.hrbeu.edu.cn/zhaoyingnan/zh_CN/index.htm",
      "started_at": null,
      "status": "current",
      "title": "讲师"
    }
  ],
  "claim_ids": [
    "claim_44c66506175b27bba1b0"
  ],
  "contacts": [
    {
      "affiliation_id": "aff_ebffddf1c0733253e0aa",
      "claim_ids": [
        "claim_44c66506175b27bba1b0"
      ],
      "is_primary": true,
      "normalized_value": "zhaoyingnan@hrbeu.edu.cn",
      "observed_at": "2026-08-21T18:46:55Z",
      "source_url": "https://faculty.hrbeu.edu.cn/zhaoyingnan/zh_CN/index.htm",
      "status": "current",
      "type": "email",
      "value": "zhaoyingnan@hrbeu.edu.cn"
    }
  ],
  "created_at": "2026-08-21T18:46:55Z",
  "field_provenance": {
    "affiliations": [
      "claim_44c66506175b27bba1b0"
    ],
    "email": [
      "claim_44c66506175b27bba1b0"
    ],
    "name": [
      "claim_44c66506175b27bba1b0"
    ],
    "profile_url": [
      "claim_44c66506175b27bba1b0"
    ],
    "research_directions": [
      "claim_44c66506175b27bba1b0"
    ],
    "status": [
      "claim_44c66506175b27bba1b0"
    ],
    "title": [
      "claim_44c66506175b27bba1b0"
    ]
  },
  "id": "mentor_672c76ac1e0f5ddfbb7e",
  "last_verified_at": "2026-08-21T18:46:55Z",
  "names": [
    {
      "claim_ids": [
        "claim_44c66506175b27bba1b0"
      ],
      "is_primary": true,
      "kind": "native",
      "value": "赵英男"
    }
  ],
  "profiles": [
    {
      "affiliation_id": "aff_ebffddf1c0733253e0aa",
      "claim_ids": [
        "claim_44c66506175b27bba1b0"
      ],
      "observed_at": "2026-08-21T18:46:55Z",
      "status": "current",
      "url": "https://faculty.hrbeu.edu.cn/zhaoyingnan/zh_CN/index.htm"
    }
  ],
  "recent_papers": [],
  "research_directions": [
    "深度强化学习、智能软件工程"
  ],
  "resolution_ids": [],
  "schema_version": 1,
  "status": "active",
  "status_observed_at": "2026-08-21T18:46:55Z",
  "status_reason": null,
  "status_source_url": "https://faculty.hrbeu.edu.cn/zhaoyingnan/zh_CN/index.htm",
  "title": "讲师",
  "updated_at": "2026-08-21T18:46:55Z"
}
