{
  "affiliations": [
    {
      "claim_ids": [
        "claim_441f8207df7eee338d54"
      ],
      "ended_at": null,
      "id": "aff_e9395d9039065cb31912",
      "is_primary": true,
      "observed_at": "2026-08-17T10:20:46Z",
      "organization_id": "org_auto_a45571a9ef64cd8fd1ba",
      "source_url": "https://jdxy.suda.edu.cn/a9/8e/c36452a698766/page.htm",
      "started_at": null,
      "status": "current",
      "title": "讲师"
    }
  ],
  "claim_ids": [
    "claim_441f8207df7eee338d54"
  ],
  "contacts": [
    {
      "affiliation_id": "aff_e9395d9039065cb31912",
      "claim_ids": [
        "claim_441f8207df7eee338d54"
      ],
      "is_primary": true,
      "normalized_value": "shengbinz@163.com",
      "observed_at": "2026-08-17T10:20:46Z",
      "source_url": "https://jdxy.suda.edu.cn/a9/8e/c36452a698766/page.htm",
      "status": "current",
      "type": "email",
      "value": "shengbinz@163.com"
    }
  ],
  "created_at": "2026-08-17T10:20:46Z",
  "field_provenance": {
    "affiliations": [
      "claim_441f8207df7eee338d54"
    ],
    "email": [
      "claim_441f8207df7eee338d54"
    ],
    "name": [
      "claim_441f8207df7eee338d54"
    ],
    "profile_url": [
      "claim_441f8207df7eee338d54"
    ],
    "recent_papers": [
      "claim_441f8207df7eee338d54"
    ],
    "research_directions": [
      "claim_441f8207df7eee338d54"
    ],
    "status": [
      "claim_441f8207df7eee338d54"
    ],
    "title": [
      "claim_441f8207df7eee338d54"
    ]
  },
  "id": "mentor_5a7c86699aebd1ecfc47",
  "last_verified_at": "2026-08-17T10:20:46Z",
  "names": [
    {
      "claim_ids": [
        "claim_441f8207df7eee338d54"
      ],
      "is_primary": true,
      "kind": "native",
      "value": "赵圣斌"
    }
  ],
  "profiles": [
    {
      "affiliation_id": "aff_e9395d9039065cb31912",
      "claim_ids": [
        "claim_441f8207df7eee338d54"
      ],
      "observed_at": "2026-08-17T10:20:46Z",
      "status": "current",
      "url": "https://jdxy.suda.edu.cn/a9/8e/c36452a698766/page.htm"
    }
  ],
  "recent_papers": [
    "Laser Additive Remanufacturing Ni-Based Multilayers Reinforced with Dual-Scale Tungsten Carbides by a Novel Integrated Strategy",
    "Statistical analysis of plasma thermodynamic behavior based on laser deep penetration welding of TC4 titanium alloy",
    "Effect of Heat Input on Microstructure and Properties of Laser-Welded 316L/In601 Dissimilar Overlap Joints in High-Temperature Thermocouple",
    "Plasma Plume Thermodynamic Behavior During Laser Deep-Penetration Welding of TC4 Titanium Alloy",
    "WC-Fe metal-matrix composite coatings fabricated by laser wire cladding",
    "Insights into microstructural evolution and dissolution characteristics of reinforced particles in tungsten carbide nickel composite coatings prepared by laser hot-wire deposition",
    "Effects of laser remelting on microstructural characteristics of Ni-WC composite coatings produced by laser hot wire cladding",
    "Carbides reinforced Ni-Ti matrix coating fabricated by laser wire deposition: Microstructure and wear behaviors"
  ],
  "research_directions": [
    "高端能源装备的激光绿色再制造与先进材料连接技术、高性能金属短波长激光增材制造和材料加工过程质量在线监控、大容量存储芯片高效微键合工艺及智能化缺陷检测研究"
  ],
  "resolution_ids": [],
  "schema_version": 1,
  "status": "active",
  "status_observed_at": "2026-08-17T10:20:46Z",
  "status_reason": null,
  "status_source_url": "https://jdxy.suda.edu.cn/a9/8e/c36452a698766/page.htm",
  "title": "讲师",
  "updated_at": "2026-08-17T10:20:46Z"
}
